Title,Release year,Plot summary,Genre,Rating,Runtime,IMDb rating,Metascore,Director,Stars,Votes,Gross
The Deer Hunter,1978,An in-depth examination of the ways in which the Vietnam War impacts and disrupts the lives of several friends in a small steel mill town in Pennsylvania.,"Drama, War",8.1,183 min,8.1,90,Michael Cimino,"Robert De Niro, Christopher Walken, John Cazale, John Savage","360,505",$48.98M
Mission: Impossible - Rogue Nation,2015,Ethan and his team take on their most impossible mission yet when they have to eradicate an international rogue organization as highly skilled as they are and committed to destroying the IMF.,"Action, Adventure, Thriller",7.4,131 min,7.4,75,Christopher McQuarrie,"Tom Cruise, Rebecca Ferguson, Jeremy Renner, Simon Pegg","408,901",$195.04M
Public Enemies,2009,"The Feds try to take down notorious American gangsters John Dillinger, Baby Face Nelson, and Pretty Boy Floyd during a booming crime wave in the 1930s.","Action, Biography, Crime",7,140 min,7,70,Michael Mann,"Christian Bale, Johnny Depp, Christian Stolte, Jason Clarke","317,642",$97.10M
Clash of the Titans,2010,"Perseus, a demigod and the son of Zeus, battles the minions of Hades and the Underworld in order to stop them from conquering Olympus and Earth.","Action, Adventure, Fantasy",5.8,106 min,5.8,39,Louis Leterrier,"Sam Worthington, Liam Neeson, Ralph Fiennes, Jason Flemyng","291,966",$163.21M
Shichinin no samurai,1954,"Farmers from a village exploited by bandits hire a veteran samurai for protection, who gathers six other samurai to join him.","Action, Drama",8.6,207 min,8.6,98,Akira Kurosawa,"Toshirô Mifune, Takashi Shimura, Keiko Tsushima, Yukiko Shimazaki","365,058",$0.27M
The Equalizer,2014,A man who believes he has put his mysterious past behind him cannot stand idly by when he meets a young girl under the control of ultra-violent Russian gangsters.,"Action, Crime, Thriller",7.2,132 min,7.2,57,Antoine Fuqua,"Denzel Washington, Marton Csokas, Chloë Grace Moretz, David Harbour","416,663",$101.53M
The Bourne Legacy,2012,"An expansion of the universe from Robert Ludlum's novels, centered on a new hero whose stakes have been triggered by the events of the previous three films.","Action, Adventure, Thriller",6.6,135 min,6.6,61,Tony Gilroy,"Jeremy Renner, Rachel Weisz, Edward Norton, Scott Glenn","314,757",$113.20M
Snow White and the Huntsman,2012,"In a twist to the fairy tale, the Huntsman ordered to take Snow White into the woods to be killed winds up becoming her protector and mentor in a quest to vanquish the Evil Queen.","Action, Adventure, Drama",6.1,127 min,6.1,57,Rupert Sanders,"Kristen Stewart, Chris Hemsworth, Charlize Theron, Sam Claflin","301,442",$155.33M
The Proposal,I) (2009,A pushy boss forces her young assistant to marry her in order to keep her visa status in the U.S. and avoid deportation to Canada.,"Comedy, Drama, Romance",6.7,108 min,6.7,48,Anne Fletcher,"Sandra Bullock, Ryan Reynolds, Mary Steenburgen, Craig T. Nelson","357,545",$163.96M
Eyes Wide Shut,1999,"A Manhattan doctor embarks on a bizarre, night-long odyssey after his wife's admission of unfulfilled longing.","Drama, Mystery, Thriller",7.5,159 min,7.5,69,Stanley Kubrick,"Tom Cruise, Nicole Kidman, Todd Field, Sydney Pollack","372,718",$55.69M
The Book of Eli,2010,"A drifter fights his way across a ravaged, post-apocalyptic America while protecting a sacred book that holds the secrets to humanity's salvation.","Action, Adventure, Drama",6.8,118 min,6.8,53,Unknown,"Albert Hughes, Allen Hughes, Denzel Washington, Mila Kunis, Ray Stevenson, Gary Oldman","337,862",$94.84M
Jack Reacher,2012,A homicide investigator digs deeper into a case involving a trained military sniper responsible for a mass shooting.,"Action, Mystery, Thriller",7,130 min,7,50,Christopher McQuarrie,"Tom Cruise, Rosamund Pike, Richard Jenkins, Werner Herzog","363,611",$80.07M
Con Air,1997,Newly-paroled ex-con and former U.S. Ranger Cameron Poe finds himself trapped in a prisoner-transport plane when the passengers seize control.,"Action, Crime, Thriller",6.9,115 min,6.9,52,Simon West,"Nicolas Cage, John Cusack, John Malkovich, Colm Meaney","317,633",$101.12M
Donnie Brasco,1997,An FBI undercover agent infiltrates the mob and finds himself identifying more with the Mafia life--at the expense of his regular one.,"Biography, Crime, Drama",7.7,127 min,7.7,77,Mike Newell,"Al Pacino, Johnny Depp, Michael Madsen, Bruno Kirby","330,560",$41.91M
300: Rise of an Empire,2014,"Greek general Themistocles of Athens leads the naval charge against invading Persian forces led by mortal-turned-god Xerxes and Artemisia, vengeful commander of the Persian navy.","Action, Drama, War",6.2,102 min,6.2,48,Noam Murro,"Sullivan Stapleton, Eva Green, Lena Headey, Hans Matheson","314,844",$106.58M
"O Brother, Where Art Thou?",2000,"In the deep south during the 1930s, three escaped convicts search for hidden treasure while a relentless lawman pursues them.","Adventure, Comedy, Crime",7.7,107 min,7.7,69,Unknown,"Joel Coen, Ethan Coen, George Clooney, John Turturro, Tim Blake Nelson, John Goodman","329,367",$45.51M
As Good as It Gets,1997,"A single mother and waitress, a misanthropic author, and a gay artist form an unlikely friendship after the artist is assaulted in a robbery.","Comedy, Drama, Romance",7.7,139 min,7.7,67,James L. Brooks,"Jack Nicholson, Helen Hunt, Greg Kinnear, Cuba Gooding Jr.","317,040",$148.48M
Moulin Rouge!,2001,A poor Bohemian poet in 1890s Paris falls for a beautiful courtesan and nightclub star coveted by a jealous duke.,"Drama, Musical, Romance",7.6,127 min,7.6,66,Baz Luhrmann,"Nicole Kidman, Ewan McGregor, John Leguizamo, Jim Broadbent","298,242",$57.39M
Green Lantern,2011,"Reckless test pilot Hal Jordan is granted an alien ring that bestows him with otherworldly powers that inducts him into an intergalactic police force, the Green Lantern Corps.","Action, Adventure, Sci-Fi",5.5,114 min,5.5,39,Martin Campbell,"Ryan Reynolds, Blake Lively, Peter Sarsgaard, Mark Strong","295,355",$116.60M
The Hangover Part III,2013,"When one of their own is kidnapped by an angry gangster, the Wolf Pack must track down Mr. Chow, who has escaped from prison and is on the run.","Comedy, Crime",5.8,100 min,5.8,30,Todd Phillips,"Bradley Cooper, Zach Galifianakis, Ed Helms, Justin Bartha","333,874",$112.20M
The Blind Side,2009,"The story of Michael Oher, a homeless and traumatized boy who became an All-American football player and first-round NFL draft pick with the help of a caring woman and her family.","Biography, Drama, Sport",7.6,129 min,7.6,53,John Lee Hancock,"Quinton Aaron, Sandra Bullock, Tim McGraw, Jae Head","358,785",$255.96M
Prince of Persia: The Sands of Time,2010,A young fugitive prince and princess must stop a villain who unknowingly threatens to destroy the world with a special dagger that enables the magic sand inside to reverse time.,"Action, Adventure, Fantasy",6.6,116 min,6.6,50,Mike Newell,"Jake Gyllenhaal, Gemma Arterton, Ben Kingsley, Alfred Molina","302,857",$90.76M
Scream,1996,"A year after the murder of her mother, a teenage girl is terrorized by a masked killer who targets her and her friends by using scary movies as part of a deadly game.","Horror, Mystery",7.4,111 min,7.4,66,Wes Craven,"Neve Campbell, Courteney Cox, David Arquette, Skeet Ulrich","386,119",$103.05M
The Nightmare Before Christmas,1993,"Jack Skellington, king of Halloween Town, discovers Christmas Town, but his attempts to bring Christmas to his home causes confusion.","Animation, Family, Fantasy",7.9,76 min,7.9,82,Henry Selick,"Danny Elfman, Chris Sarandon, Catherine O'Hara, William Hickey","373,590",$75.08M
10 Things I Hate About You,1999,"A high-school boy, Cameron, cannot date Bianca until her anti-social older sister, Kat, has a boyfriend. So, Cameron pays a mysterious boy, Patrick, to charm Kat.","Comedy, Drama, Romance",7.3,97 min,7.3,70,Gil Junger,"Heath Ledger, Julia Stiles, Joseph Gordon-Levitt, Larisa Oleynik","381,425",$38.18M
Starship Troopers,1997,"Humans, in a fascist militaristic future, wage war with giant alien bugs.","Action, Adventure, Sci-Fi",7.3,129 min,7.3,52,Paul Verhoeven,"Casper Van Dien, Denise Richards, Dina Meyer, Jake Busey","318,547",$54.81M
Mononoke-hime,1997,"On a journey to find the cure for a Tatarigami's curse, Ashitaka finds himself in the middle of a war between the forest gods and Tatara, a mining colony. In this quest he also meets San, the Mononoke Hime.","Animation, Action, Adventure",8.3,134 min,8.3,76,Hayao Miyazaki,"Yôji Matsuda, Yuriko Ishida, Yûko Tanaka, Billy Crudup","430,285",$2.38M
The Twilight Saga: New Moon,2009,"Edward leaves Bella after an attack that nearly claimed her life, and, in her depression, she falls into yet another difficult relationship - this time with her close friend, Jacob Black.","Adventure, Drama, Fantasy",4.8,130 min,4.8,44,Chris Weitz,"Kristen Stewart, Robert Pattinson, Taylor Lautner, Christina Jastrzembska","298,900",$296.62M
Once Upon a Time in America,1984,"A former Prohibition-era Jewish gangster returns to the Lower East Side of Manhattan 35 years later, where he must once again confront the ghosts and regrets of his old life.","Crime, Drama",8.3,229 min,8.3,75,Sergio Leone,"Robert De Niro, James Woods, Elizabeth McGovern, Treat Williams","375,599",$5.32M
How to Train Your Dragon 2,2014,"When Hiccup and Toothless discover an ice cave that is home to hundreds of new wild dragons and the mysterious Dragon Rider, the two friends find themselves at the center of a battle to protect the peace.","Animation, Action, Adventure",7.8,102 min,7.8,77,Dean DeBlois,"Jay Baruchel, Cate Blanchett, Gerard Butler, Craig Ferguson","361,855",$177.00M
GATTACA,1997,A genetically inferior man assumes the identity of a superior one in order to pursue his lifelong dream of space travel.,"Drama, Sci-Fi, Thriller",7.7,106 min,7.7,64,Andrew Niccol,"Ethan Hawke, Uma Thurman, Jude Law, Gore Vidal","321,751",$12.34M
The Mist,2007,"A freak storm unleashes a species of bloodthirsty creatures on a small town, where a small band of citizens hole up in a supermarket and fight for their lives.","Horror, Sci-Fi, Thriller",7.1,126 min,7.1,58,Frank Darabont,"Thomas Jane, Marcia Gay Harden, Laurie Holden, Andre Braugher","337,984",$25.59M
Liar Liar,1997,A pathological liar-lawyer finds his career turned upside down when he inexplicably cannot physically lie for 24 whole hours.,"Comedy, Fantasy",6.9,86 min,6.9,70,Tom Shadyac,"Jim Carrey, Maura Tierney, Amanda Donohoe, Jennifer Tilly","331,637",$181.41M
North by Northwest,1959,"A New York City advertising executive goes on the run after being mistaken for a government agent by a group of foreign spies, and falls for a woman whose loyalties he begins to doubt.","Action, Adventure, Mystery",8.3,136 min,8.3,98,Alfred Hitchcock,"Cary Grant, Eva Marie Saint, James Mason, Jessie Royce Landis","344,602",$13.28M
Fifty Shades of Grey,2015,"Literature student Anastasia Steele's life changes forever when she meets handsome, yet tormented, billionaire Christian Grey.","Drama, Romance, Thriller",4.2,125 min,4.2,46,Sam Taylor-Johnson,"Dakota Johnson, Jamie Dornan, Jennifer Ehle, Eloise Mumford","334,554",$166.17M
Jurassic Park III,2001,"A decidedly odd couple with ulterior motives convince Dr. Grant to go to Isla Sorna for a holiday, but their unexpected landing startles the island's new inhabitants.","Action, Adventure, Sci-Fi",5.9,92 min,5.9,42,Joe Johnston,"Sam Neill, William H. Macy, Téa Leoni, Alessandro Nivola","339,558",$181.17M
Top Gun,1986,"As students at the United States Navy's elite fighter weapons school compete to be best in the class, one daring young pilot learns a few things from a civilian instructor that are not taught in the classroom.","Action, Drama",6.9,109 min,6.9,50,Tony Scott,"Tom Cruise, Tim Robbins, Kelly McGillis, Val Kilmer","498,960",$179.80M
The Untouchables,1987,"During Prohibition, Treasury agent Eliot Ness sets out to stop ruthless Chicago gangster Al Capone, and assembles a small, incorruptible team to help him.","Crime, Drama, Thriller",7.8,119 min,7.8,79,Brian De Palma,"Eliot Ness, Al Capone, Kevin Costner, Sean Connery, Robert De Niro, Charles Martin Smith","329,323",$76.27M
From Dusk Till Dawn,1996,"Two criminals and their hostages unknowingly seek temporary refuge in a truck stop populated by vampires, with chaotic results.","Action, Crime, Horror",7.2,108 min,7.2,48,Robert Rodriguez,"Harvey Keitel, George Clooney, Juliette Lewis, Quentin Tarantino","338,532",$25.75M
Insomnia,2002,Two Los Angeles homicide detectives are dispatched to a northern town where the sun doesn't set to investigate the methodical murder of a local teen.,"Drama, Mystery, Thriller",7.2,118 min,7.2,78,Christopher Nolan,"Al Pacino, Robin Williams, Hilary Swank, Martin Donovan","317,147",$67.36M
Bridesmaids,I) (2011,"Competition between the maid of honor and a bridesmaid, over who is the bride's best friend, threatens to upend the life of an out-of-work pastry chef.",Comedy,6.8,125 min,6.8,75,Paul Feig,"Kristen Wiig, Maya Rudolph, Rose Byrne, Terry Crews","307,891",$169.11M
Gone in Sixty Seconds,2000,A retired master car thief must come back to the industry and steal fifty cars with his crew in one night to save his brother's life.,"Action, Crime, Thriller",6.5,118 min,6.5,35,Dominic Sena,"Nicolas Cage, Angelina Jolie, Giovanni Ribisi, T.J. Cross","293,411",$101.65M
Wo hu cang long,2000,A young Chinese warrior steals a sword from a famed swordsman and then escapes into a world of romantic adventure with a mysterious man in the frontier of the nation.,"Action, Adventure, Drama",7.9,120 min,7.9,94,Ang Lee,"Chow Yun-Fat, Michelle Yeoh, Ziyi Zhang, Chang Chen","280,849",$128.08M
Forgetting Sarah Marshall,2008,"Devastated Peter takes a Hawaiian vacation in order to deal with the recent break-up with his TV star girlfriend, Sarah. Little does he know, Sarah's traveling to the same resort as her ex - and she's bringing along her new boyfriend.","Comedy, Drama, Romance",7.1,111 min,7.1,67,Nicholas Stoller,"Kristen Bell, Jason Segel, Paul Rudd, Mila Kunis","301,273",$63.17M
Law Abiding Citizen,2009,A frustrated man decides to take justice into his own hands after a plea bargain sets one of his family's killers free.,"Action, Crime, Drama",7.4,109 min,7.4,34,F. Gary Gray,"Gerard Butler, Jamie Foxx, Leslie Bibb, Colm Meaney","317,776",$73.34M
Kingdom of Heaven,2005,"Balian of Ibelin travels to Jerusalem during the Crusades of the 12th century, and there he finds himself as the defender of the city and its people.","Action, Adventure, Drama",7.3,144 min,7.3,63,Ridley Scott,"Orlando Bloom, Eva Green, Liam Neeson, Martin Hancock","312,063",$47.40M
Ace Ventura: Pet Detective,1994,A goofy detective specializing in animals goes in search of the missing mascot of the Miami Dolphins.,Comedy,6.9,86 min,6.9,37,Tom Shadyac,"Jim Carrey, Courteney Cox, Sean Young, Tone Loc","323,319",$72.22M
Neighbors,I) (2014,"After they are forced to live next to a fraternity house, a couple with a newborn baby do whatever they can to take them down.",Comedy,6.3,97 min,6.3,68,Nicholas Stoller,"Seth Rogen, Rose Byrne, Zac Efron, Lisa Kudrow","328,142",$150.16M
Zero Dark Thirty,2012,"A chronicle of the decade-long hunt for al-Qaeda terrorist leader Osama bin Laden after the September 2001 attacks, and his death at the hands of the Navy S.E.A.L.s Team 6 in May 2011.","Drama, History, Thriller",7.4,157 min,7.4,95,Kathryn Bigelow,"Osama bin Laden, Jessica Chastain, Joel Edgerton, Chris Pratt, Mark Strong","317,670",$95.72M
Chinatown,1974,"A private detective hired to expose an adulterer in 1930s Los Angeles finds himself caught up in a web of deceit, corruption, and murder.","Drama, Mystery, Thriller",8.1,130 min,8.1,92,Roman Polanski,"Jack Nicholson, Faye Dunaway, John Huston, Perry Lopez","347,801",N/A
Once Upon a Time in the West,1968,A mysterious stranger with a harmonica joins forces with a notorious desperado to protect a beautiful widow from a ruthless assassin working for the railroad.,Western,8.5,166 min,8.5,82,Sergio Leone,"Henry Fonda, Charles Bronson, Claudia Cardinale, Jason Robards","347,710",$5.32M
Gone with the Wind,1939,A sheltered and manipulative Southern belle and a roguish profiteer face off in a turbulent romance as the society around them crumbles with the end of slavery and is rebuilt during the Civil War and Reconstruction periods.,"Drama, Romance, War",8.2,238 min,8.2,97,Unknown,"Victor Fleming, George Cukor, Sam Wood, Clark Gable, Vivien Leigh, Thomas Mitchell, Barbara O'Neil","332,670",$198.68M
Batman Returns,1992,"While Batman deals with a deformed man calling himself the Penguin wreaking havoc across Gotham with the help of a cruel businessman, a female employee of the latter becomes the Catwoman with her own vendetta.","Action, Crime, Fantasy",7.1,126 min,7.1,68,Tim Burton,"Michael Keaton, Danny DeVito, Michelle Pfeiffer, Christopher Walken","325,800",$162.83M
To Kill a Mockingbird,1962,"Atticus Finch, a widowed lawyer in Depression-era Alabama, defends a Black man against an undeserved rape charge, and tries to educate his young children against prejudice.","Crime, Drama",8.3,129 min,8.3,88,Robert Mulligan,"Gregory Peck, John Megna, Frank Overton, Rosemary Murphy","331,535",N/A
The Dictator,2012,The heroic story of a dictator who risked his life to ensure that democracy would never come to the country he so lovingly oppressed.,Comedy,6.4,83 min,6.4,58,Larry Charles,"Sacha Baron Cohen, Anna Faris, John C. Reilly, Ben Kingsley","332,782",$59.65M
Hauru no ugoku shiro,2004,"When an unconfident young woman is cursed with an old body by a spiteful witch, her only chance of breaking the spell lies with a self-indulgent yet insecure young wizard and his companions in his legged, walking castle.","Animation, Adventure, Family",8.2,119 min,8.2,82,Hayao Miyazaki,"Chieko Baishô, Takuya Kimura, Tatsuya Gashûin, Akihiro Miwa","444,323",$4.71M
Pitch Perfect,2012,"Beca, a freshman at Barden University, is cajoled into joining The Bellas, her school's all-girls singing group. Injecting some much needed energy into their repertoire, The Bellas take on their male rivals in a campus competition.","Comedy, Music, Romance",7.1,112 min,7.1,66,Jason Moore,"Anna Kendrick, Brittany Snow, Rebel Wilson, Anna Camp","329,241",$65.00M
The Fugitive,1993,"Dr. Richard Kimble, unjustly accused of murdering his wife, must find the real killer while being the target of a nationwide manhunt led by a seasoned U.S. Marshal.","Action, Crime, Drama",7.8,130 min,7.8,87,Andrew Davis,"Harrison Ford, Tommy Lee Jones, Sela Ward, Julianne Moore","316,576",$183.88M
Pretty Woman,1990,"A man in a legal but hurtful business needs an escort for some social events, and hires a beautiful prostitute he meets... only to fall in love.","Comedy, Romance",7.1,119 min,7.1,51,Garry Marshall,"Richard Gere, Julia Roberts, Jason Alexander, Laura San Giacomo","358,819",$178.41M
4: Rise of the Silver Surfer,2007,The Fantastic Four learn that they aren't the only super-powered beings in the universe when they square off against the powerful Silver Surfer and the planet-eating Galactus.,"Action, Adventure, Fantasy",5.6,92 min,5.6,45,Tim Story,"Ioan Gruffudd, Jessica Alba, Chris Evans, Michael Chiklis","276,555",$131.92M
Fear and Loathing in Las Vegas,1998,An oddball journalist and his psychopathic lawyer travel to Las Vegas for a series of psychedelic escapades.,"Adventure, Comedy, Drama",7.5,118 min,7.5,41,Terry Gilliam,"Johnny Depp, Benicio Del Toro, Tobey Maguire, Michael Lee Gogin","300,317",$10.68M
Step Brothers,2008,Two aimless middle-aged losers still living at home are forced against their will to become roommates when their parents marry.,Comedy,6.9,98 min,6.9,51,Adam McKay,"Will Ferrell, John C. Reilly, Mary Steenburgen, Richard Jenkins","317,267",$100.47M
John Carter,2012,"Transported to Barsoom, a Civil War vet discovers a barren planet seemingly inhabited by 12-foot tall barbarians. Finding himself prisoner of these creatures, he escapes, only to encounter Woola and a princess in desperate need of a savior.","Action, Adventure, Sci-Fi",6.6,132 min,6.6,51,Andrew Stanton,"Taylor Kitsch, Lynn Collins, Willem Dafoe, Samantha Morton","285,264",$73.08M
Stardust,2007,"In a countryside town bordering on a magical land, a young man makes a promise to his beloved that he'll retrieve a fallen star by venturing into the magical realm.","Adventure, Family, Fantasy",7.6,127 min,7.6,66,Matthew Vaughn,"Charlie Cox, Claire Danes, Sienna Miller, Ian McKellen","284,203",$38.63M
28 Weeks Later,2007,"Six months after the rage virus was inflicted on the population of Great Britain, the US Army helps to secure a small area of London for the survivors to repopulate and start again. But not everything goes according to plan.","Horror, Sci-Fi",6.9,100 min,6.9,78,Juan Carlos Fresnadillo,"Jeremy Renner, Rose Byrne, Robert Carlyle, Harold Perrineau","292,300",$28.64M
Hulk,2003,"Bruce Banner, a genetics researcher with a tragic past, suffers an accident that causes him to transform into a raging green monster when he gets angry.","Action, Sci-Fi",5.6,138 min,5.6,54,Ang Lee,"Eric Bana, Jennifer Connelly, Sam Elliott, Josh Lucas","277,838",$132.18M
Robin Hood,2010,"In twelfth-century England, Robin Longstride and his band of marauders confront corruption in a local village and lead an uprising against the crown that will forever alter the balance of world power.","Action, Adventure, Drama",6.6,140 min,6.6,53,Ridley Scott,"Russell Crowe, Cate Blanchett, Matthew Macfadyen, Max von Sydow","282,247",$105.27M
Shrek the Third,2007,"Reluctantly designated as the heir to the land of Far, Far Away, Shrek hatches a plan to install the rebellious Artie as the new king while Princess Fiona tries to fend off a coup d'état by the jilted Prince Charming.","Animation, Adventure, Comedy",6.1,93 min,6.1,58,Unknown,"Chris Miller, Raman Hui, Mike Myers, Cameron Diaz, Eddie Murphy, Antonio Banderas","330,559",$320.71M
The A-Team,2010,"A group of Iraq War veterans look to clear their name with the U.S. Military, who suspect the four men of committing a crime for which they were framed.","Action, Adventure, Crime",6.7,117 min,6.7,47,Joe Carnahan,"Liam Neeson, Bradley Cooper, Sharlto Copley, Jessica Biel","268,375",$77.22M
Meet the Fockers,2004,All hell breaks loose when the Byrnes family meets the Focker family for the first time.,"Comedy, Romance",6.3,115 min,6.3,41,Jay Roach,"Ben Stiller, Robert De Niro, Blythe Danner, Teri Polo","285,545",$279.26M
A Bug's Life,1998,"A misfit ant, looking for ""warriors"" to save his colony from greedy grasshoppers, recruits a group of bugs that turn out to be an inept circus troupe.","Animation, Adventure, Comedy",7.2,95 min,7.2,78,Unknown,"John Lasseter, Andrew Stanton, Kevin Spacey, David Foley, Julia Louis-Dreyfus, Hayden Panettiere","312,943",$162.80M
The Graduate,1967,A disillusioned college graduate finds himself torn between his older lover and her daughter.,"Comedy, Drama, Romance",8,106 min,8,83,Mike Nichols,"Dustin Hoffman, Anne Bancroft, Katharine Ross, William Daniels","287,448",$104.95M
School of Rock,2003,"After being kicked out of his rock band, Dewey Finn becomes a substitute teacher of an uptight elementary private school, only to try and turn his class into a rock band.","Comedy, Music",7.2,109 min,7.2,82,Richard Linklater,"Jack Black, Mike White, Joan Cusack, Adam Pascal","328,772",$81.26M
Unknown,I) (2011,"When a man awakens from a coma only to discover that someone has taken on his identity, he teams up with a young woman to prove who he is.","Action, Mystery, Thriller",6.8,113 min,6.8,56,Jaume Collet-Serra,"Liam Neeson, Diane Kruger, January Jones, Aidan Quinn","268,832",$63.69M
1408,2007,"A man who specialises in debunking paranormal occurrences checks into the fabled room 1408 in the Dolphin Hotel. Soon after settling in, he confronts genuine terror.","Fantasy, Horror, Mystery",6.8,104 min,6.8,64,Mikael Håfström,"John Cusack, Samuel L. Jackson, Mary McCormack, Tony Shalhoub","292,791",$71.99M
Death Proof,2007,"Two separate sets of voluptuous women are stalked at different times by a scarred stuntman who uses his ""death proof"" cars to execute his murderous plans.","Action, Thriller",7,127 min,7,N/A,Quentin Tarantino,"Kurt Russell, Zoë Bell, Rosario Dawson, Vanessa Ferlito","312,259",N/A
The Royal Tenenbaums,2001,The eccentric members of a dysfunctional family reluctantly gather under the same roof for various reasons.,"Comedy, Drama",7.6,110 min,7.6,76,Wes Anderson,"Gene Hackman, Gwyneth Paltrow, Anjelica Huston, Ben Stiller","312,059",$52.36M
Apollo 13,I) (1995,NASA must devise a strategy to return Apollo 13 to Earth safely after the spacecraft undergoes massive internal damage putting the lives of the three astronauts on board in jeopardy.,"Adventure, Drama, History",7.7,140 min,7.7,78,Ron Howard,"Tom Hanks, Bill Paxton, Kevin Bacon, Gary Sinise","313,869",$173.84M
Hannibal,2001,"Living in exile, Dr. Hannibal Lecter tries to reconnect with now disgraced F.B.I. Agent Clarice Starling, and finds himself a target for revenge from a powerful victim.","Crime, Drama, Thriller",6.8,131 min,6.8,57,Ridley Scott,"Anthony Hopkins, Julianne Moore, Gary Oldman, Ray Liotta","291,816",$165.09M
Hellboy II: The Golden Army,2008,A prince of the mythical world starts a rebellion against humanity in order to rule the Earth. Hellboy and his team must fight to stop him from locating the all-powerful Golden Army.,"Action, Adventure, Fantasy",7,120 min,7,78,Guillermo del Toro,"Ron Perlman, Selma Blair, Doug Jones, John Alexander","284,923",$75.75M
Underworld,2003,"Selene, a vampire warrior, is entrenched in a conflict between vampires and werewolves, while falling in love with Michael, a human who is sought by werewolves for unknown reasons.","Action, Fantasy, Thriller",7,121 min,7,42,Len Wiseman,"Kate Beckinsale, Scott Speedman, Shane Brolly, Michael Sheen","284,093",$51.97M
