Title,Release year,Plot summary,Genre,Rating,Runtime,IMDb rating,Metascore,Director,Stars,Votes,Gross
The Lincoln Lawyer,2011,A lawyer defending a wealthy man begins to believe his client is guilty of more than just one crime.,"Crime, Drama, Mystery",7.3,118 min,7.3,63,Brad Furman,"Matthew McConaughey, Marisa Tomei, Ryan Phillippe, William H. Macy","252,829",$58.01M
Gangster Squad,2013,"It's 1949 Los Angeles, the city is run by gangsters and a malicious mobster, Mickey Cohen. Determined to end the corruption, John O'Mara assembles a team of cops, ready to take down the ruthless leader and restore peace to the city.","Action, Crime, Drama",6.7,113 min,6.7,40,Ruben Fleischer,"Sean Penn, Ryan Gosling, Emma Stone, Giovanni Ribisi","222,258",$46.00M
Amores perros,2000,"A horrific car accident connects three stories, each involving characters dealing with loss, regret, and life's harsh realities, all in the name of love.","Drama, Thriller",8.1,154 min,8.1,83,Alejandro G. Iñárritu,"Emilio Echevarría, Gael García Bernal, Goya Toledo, Álvaro Guerrero","251,996",$5.38M
Låt den rätte komma in,2008,"Oskar, an overlooked and bullied boy, finds love and revenge through Eli, a beautiful but peculiar girl.","Drama, Fantasy, Horror",7.8,114 min,7.8,82,Tomas Alfredson,"Kåre Hedebrant, Lina Leandersson, Per Ragnar, Henrik Dahl","226,085",$2.12M
Natural Born Killers,1994,Two victims of traumatized childhoods become lovers and psychopathic serial murderers irresponsibly glorified by the mass media.,"Action, Crime, Romance",7.2,119 min,7.2,74,Oliver Stone,"Woody Harrelson, Juliette Lewis, Tom Sizemore, Rodney Dangerfield","250,646",$50.28M
Silent Hill,2006,"A woman, Rose, goes in search for her adopted daughter within the confines of a strange, desolate town called Silent Hill.","Horror, Mystery",6.5,125 min,6.5,31,Christophe Gans,"Radha Mitchell, Laurie Holden, Sean Bean, Deborah Kara Unger","243,008",$46.98M
Just Go with It,2011,"On a weekend trip to Hawaii, a plastic surgeon convinces his loyal assistant to pose as his soon-to-be-divorced wife in order to cover up a careless lie he told to his much-younger girlfriend.","Comedy, Romance",6.4,117 min,6.4,33,Dennis Dugan,"Adam Sandler, Jennifer Aniston, Brooklyn Decker, Nicole Kidman","263,928",$103.03M
Transcendence,I) (2014,A scientist's drive for artificial intelligence takes on dangerous implications when his own consciousness is uploaded into one such program.,"Action, Drama, Sci-Fi",6.2,119 min,6.2,42,Wally Pfister,"Johnny Depp, Rebecca Hall, Morgan Freeman, Cillian Murphy","238,190",$23.02M
Chappie,2015,"In the near future, crime is patrolled by a mechanized police force. When one police droid, Chappie, is stolen and given new programming, he becomes the first robot with the ability to think and feel for himself.","Action, Crime, Drama",6.8,120 min,6.8,41,Neill Blomkamp,"Sharlto Copley, Dev Patel, Hugh Jackman, Sigourney Weaver","268,350",$31.57M
Megamind,2010,"Evil genius Megamind finally defeats his do-gooder nemesis, Metro Man, but is left without a purpose in a superhero-free world.","Animation, Action, Adventure",7.3,95 min,7.3,63,Tom McGrath,"Will Ferrell, Jonah Hill, Brad Pitt, Tina Fey","293,158",$148.42M
First Blood,1982,A veteran Green Beret is forced by a cruel Sheriff and his deputies to flee into the mountains and wage an escalating one-man war against his pursuers.,"Action, Adventure, Thriller",7.7,93 min,7.7,61,Ted Kotcheff,"Sylvester Stallone, Brian Dennehy, Richard Crenna, Bill McKinney","273,738",$47.21M
Bad Boys,1995,Two hip detectives protect a witness to a murder while investigating a case of stolen heroin from the evidence storage room from their police precinct.,"Action, Comedy, Crime",6.8,119 min,6.8,41,Michael Bay,"Will Smith, Martin Lawrence, Lisa Boyle, Michael Taliferro","284,466",$65.81M
Mars Attacks!,1996,Earth is invaded by Martians with unbeatable weapons and a cruel sense of humor.,"Comedy, Sci-Fi",6.4,106 min,6.4,52,Tim Burton,"Jack Nicholson, Pierce Brosnan, Sarah Jessica Parker, Annette Bening","242,320",$37.77M
American Reunion,2012,"Jim, Michelle, Stifler, and their friends reunite in East Great Falls, Michigan for their high school reunion.",Comedy,6.7,113 min,6.7,49,Unknown,"Jon Hurwitz, Hayden Schlossberg, Jason Biggs, Alyson Hannigan, Seann William Scott, Chris Klein","223,273",$57.01M
Chicago,2002,"Two death-row murderesses develop a fierce rivalry while competing for publicity, celebrity, and a sleazy lawyer's attention.","Comedy, Crime, Musical",7.2,113 min,7.2,81,Rob Marshall,"Renée Zellweger, Catherine Zeta-Jones, Richard Gere, Taye Diggs","242,394",$170.69M
Cowboys & Aliens,2011,"A spaceship arrives in 1873 Arizona to take over the Earth, starting with the Wild West region. All that stands in their way: a posse of cowboys and natives.","Action, Drama, Sci-Fi",6,119 min,6,50,Jon Favreau,"Daniel Craig, Harrison Ford, Olivia Wilde, Abigail Spencer","231,784",$100.24M
Tonari no Totoro,1988,"When two girls move to the country to be near their ailing mother, they have adventures with the wondrous forest spirits who live nearby.","Animation, Comedy, Family",8.1,86 min,8.1,86,Hayao Miyazaki,"Hitoshi Takagi, Noriko Hidaka, Chika Sakamoto, Shigesato Itoi","376,719",$1.11M
What's Eating Gilbert Grape,1993,A young man in a small Midwestern town struggles to care for his mentally-disabled younger brother and morbidly obese mother while attempting to pursue his own happiness.,Drama,7.7,118 min,7.7,73,Lasse Hallström,"Johnny Depp, Leonardo DiCaprio, Juliette Lewis, Mary Steenburgen","252,896",$9.17M
Gandhi,1982,The life of the lawyer who became the famed leader of the Indian revolts against the British rule through his philosophy of nonviolent protest.,"Biography, Drama, History",8,191 min,8,79,Richard Attenborough,"Ben Kingsley, John Gielgud, Rohini Hattangadi, Roshan Seth","239,688",$52.77M
Bridget Jones's Diary,2001,Bridget Jones is determined to improve herself while she looks for love in a year in which she keeps a personal diary.,"Comedy, Drama, Romance",6.8,97 min,6.8,66,Sharon Maguire,"Renée Zellweger, Colin Firth, Hugh Grant, Gemma Jones","262,110",$71.54M
Mulan,1998,"To save her father from death in the army, a young maiden secretly goes in his place and becomes one of China's greatest heroines in the process.","Animation, Adventure, Comedy",7.7,87 min,7.7,72,Unknown,"Tony Bancroft, Barry Cook, Ming-Na Wen, Eddie Murphy, BD Wong, Miguel Ferrer","314,307",$120.62M
Predators,2010,A group of elite warriors parachute into an unfamiliar jungle and are hunted by members of a merciless alien race.,"Action, Adventure, Fantasy",6.4,107 min,6.4,51,Nimród Antal,"Adrien Brody, Laurence Fishburne, Topher Grace, Alice Braga","242,930",$52.00M
The Girl Next Door,2004,A teenager's dreams come true when a former porn star moves in next door and they fall in love.,"Comedy, Drama, Romance",6.7,109 min,6.7,47,Luke Greenfield,"Emile Hirsch, Nicholas Downs, Elisha Cuthbert, Timothy Olyphant","238,507",$14.59M
Anger Management,2003,"Dave Buznik is a businessman who is wrongly sentenced to an anger management program, where he meets an aggressive instructor.",Comedy,6.2,106 min,6.2,52,Peter Segal,"Jack Nicholson, Adam Sandler, Marisa Tomei, Luis Guzmán","227,487",$135.65M
Traffic,2000,"A conservative judge is appointed by the President to spearhead America's escalating war against drugs, only to discover that his teenage daughter is a crack addict. Two DEA agents protect an informant. A jailed drug baron's wife attempts to carry on the family business.","Crime, Drama, Thriller",7.6,147 min,7.6,86,Steven Soderbergh,"Michael Douglas, Benicio Del Toro, Catherine Zeta-Jones, Jacob Vargas","219,031",$124.12M
Alien Resurrection,1997,"Two centuries after her death, a powerful human/alien hybrid clone of Ellen Ripley aids a crew of space pirates in stopping the aliens from reaching Earth.","Action, Horror, Sci-Fi",6.2,109 min,6.2,62,Jean-Pierre Jeunet,"Sigourney Weaver, Winona Ryder, Dominique Pinon, Ron Perlman","262,034",$47.75M
Die Another Day,2002,"James Bond is sent to investigate the connection between a North Korean terrorist and a diamond mogul, who is funding the development of an international space weapon.","Action, Adventure, Thriller",6.1,133 min,6.1,56,Lee Tamahori,"Pierce Brosnan, Halle Berry, Rosamund Pike, Toby Stephens","228,533",$160.94M
The Little Mermaid,1989,A mermaid princess makes a Faustian bargain in an attempt to become human and win a prince's love.,"Animation, Adventure, Family",7.6,83 min,7.6,88,Unknown,"Ron Clements, John Musker, Jodi Benson, Samuel E. Wright, Rene Auberjonois, Christopher Daniel Barnes","289,461",$111.54M
Grease,1978,"Good girl Sandy Olsson and greaser Danny Zuko fell in love over the summer. When they unexpectedly discover they're now in the same high school, will they be able to rekindle their romance?","Comedy, Musical, Romance",7.2,110 min,7.2,70,Randal Kleiser,"John Travolta, Olivia Newton-John, Stockard Channing, Jeff Conaway","298,733",$188.76M
Jagten,2012,"A teacher lives a lonely life, all the while struggling over his son's custody. His life slowly gets better as he finds love and receives good news from his son, but his new luck is about to be brutally shattered by an innocent little lie.",Drama,8.3,115 min,8.3,77,Thomas Vinterberg,"Mads Mikkelsen, Thomas Bo Larsen, Annika Wedderkopp, Lasse Fogelstrøm","361,611",$0.69M
Meet Joe Black,1998,"Death, who takes the form of a young man killed in an accident, asks a media mogul to act as his guide to teach him about life on Earth and, in the process, he falls in love with the mogul's daughter.","Drama, Fantasy, Romance",7.2,178 min,7.2,43,Martin Brest,"Brad Pitt, Anthony Hopkins, Claire Forlani, Jake Weber","263,247",$44.62M
No Strings Attached,I) (2011,"A guy and girl try to keep their relationship strictly physical, but it's not long before they learn that they want something more.","Comedy, Romance",6.2,108 min,6.2,50,Ivan Reitman,"Natalie Portman, Ashton Kutcher, Kevin Kline, Cary Elwes","243,172",$70.66M
Closer,I) (2004,The relationships of two couples become complicated and deceitful when the man from one couple meets the woman of the other.,"Drama, Romance",7.2,104 min,7.2,65,Mike Nichols,"Natalie Portman, Jude Law, Clive Owen, Julia Roberts","235,163",$33.99M
Before Sunset,2004,"Nine years after Jesse and Celine first met, they encounter each other again on the French leg of Jesse's book tour.","Drama, Romance",8.1,80 min,8.1,91,Richard Linklater,"Ethan Hawke, Julie Delpy, Vernon Dobtcheff, Louise Lemoine Torrès","286,235",$5.82M
Master and Commander: The Far Side of the World,2003,"During the Napoleonic Wars, a brash British captain pushes his ship and crew to their limits in pursuit of a formidable French war vessel around South America.","Action, Adventure, Drama",7.5,138 min,7.5,81,Peter Weir,"Russell Crowe, Paul Bettany, Billy Boyd, James D'Arcy","236,736",$93.93M
Get Smart,2008,"Maxwell Smart, a highly intellectual but bumbling spy working for the CONTROL agency, is tasked with preventing a terrorist attack from rival spy agency KAOS.","Action, Adventure, Comedy",6.5,110 min,6.5,54,Peter Segal,"Steve Carell, Anne Hathaway, Alan Arkin, Dwayne Johnson","227,992",$130.32M
Das Boot,1981,A German U-boat stalks the frigid waters of the North Atlantic as its young crew experience the sheer terror and claustrophobic life of a submariner in World War II.,"Drama, War",8.4,149 min,8.4,85,Wolfgang Petersen,"Jürgen Prochnow, Herbert Grönemeyer, Klaus Wennemann, Hubertus Bengsch","263,223",$11.49M
Planet Terror,2007,"After an experimental bio-weapon is released, turning thousands into zombie-like creatures, it's up to a rag-tag group of survivors to stop the infected and those behind its release.","Action, Comedy, Horror",7,105 min,7,N/A,Robert Rodriguez,"Rose McGowan, Freddy Rodríguez, Josh Brolin, Marley Shelton","222,393",N/A
P.S. I Love You,2007,A young widow discovers that her late husband has left her 10 messages intended to help ease her pain and start a new life.,"Comedy, Drama, Romance",7,126 min,7,39,Richard LaGravenese,"Hilary Swank, Gerard Butler, Harry Connick Jr., Lisa Kudrow","217,825",$53.70M
Ip Man,2008,"During the Japanese invasion of China, a wealthy martial artist is forced to leave his home when his city is occupied. With little means of providing for themselves, Ip Man and the remaining members of the city must find a way to survive.","Action, Biography, Drama",8,106 min,8,59,Wilson Yip,"Donnie Yen, Simon Yam, Siu-Wong Fan, Ka-Tung Lam","232,884",N/A
Spy,2015,A desk-bound CIA analyst volunteers to go undercover to infiltrate the world of a deadly arms dealer and prevent diabolical global disaster.,"Action, Comedy",7,120 min,7,75,Paul Feig,"Melissa McCarthy, Rose Byrne, Jude Law, Jason Statham","257,868",$110.83M
Zootopia,2016,"In a city of anthropomorphic animals, a rookie bunny cop and a cynical con artist fox must work together to uncover a conspiracy.","Animation, Adventure, Comedy",8,108 min,8,78,Unknown,"Byron Howard, Rich Moore, Jared Bush, Ginnifer Goodwin, Jason Bateman, Idris Elba, Jenny Slate","542,270",$341.27M
Romeo + Juliet,1996,Shakespeare's famous play is updated to the hip modern suburb of Verona still retaining its original dialogue.,"Drama, Romance",6.7,120 min,6.7,60,Baz Luhrmann,"Leonardo DiCaprio, Claire Danes, John Leguizamo, Harold Perrineau","243,538",$46.35M
Teenage Mutant Ninja Turtles,2014,"When a kingpin threatens New York City, a group of mutated turtle warriors must emerge from the shadows to protect their home.","Action, Adventure, Comedy",5.8,101 min,5.8,31,Jonathan Liebesman,"Megan Fox, Will Arnett, William Fichtner, Noel Fisher","219,415",$191.20M
Safe House,2012,"A young CIA agent is tasked with looking after a fugitive in a safe house. But when the safe house is attacked, he finds himself on the run with his charge.","Action, Thriller",6.7,115 min,6.7,52,Daniel Espinosa,"Denzel Washington, Ryan Reynolds, Robert Patrick, Vera Farmiga","234,649",$126.37M
Death Race,2008,Ex-con Jensen Ames is forced by the warden of a notorious prison to compete in our post-industrial world's most popular sport: a car race in which inmates must brutalize and kill one another on the road to victory.,"Action, Sci-Fi, Thriller",6.4,105 min,6.4,43,Paul W.S. Anderson,"Jason Statham, Joan Allen, Tyrese Gibson, Ian McShane","218,273",$36.32M
Ice Age: Dawn of the Dinosaurs,2009,"When Sid's attempt to adopt three dinosaur eggs gets him abducted by their real mother to an underground lost world, his friends attempt to rescue him.","Animation, Adventure, Comedy",6.9,94 min,6.9,50,Unknown,"Carlos Saldanha, Michael Thurmeier, Ray Romano, John Leguizamo, Denis Leary, Eunice Cho","262,743",$196.57M
"I Love You, Man",2009,"Friendless Peter Klaven goes on a series of man-dates to find a Best Man for his wedding. But, when his insta-bond with his new B.F.F. puts a strain on his relationship with his fiancée, can the trio learn to live happily ever after?","Comedy, Romance",7,105 min,7,70,John Hamburg,"Paul Rudd, Jason Segel, Rashida Jones, Sarah Burns","216,129",$71.44M
Match Point,2005,"At a turning point in his life, a former tennis pro falls for an actress who happens to be dating his friend and soon-to-be brother-in-law.","Drama, Romance, Thriller",7.6,124 min,7.6,72,Woody Allen,"Scarlett Johansson, Jonathan Rhys Meyers, Emily Mortimer, Matthew Goode","227,392",$23.09M
Machete,2010,"After being set-up and betrayed by the man who hired him to assassinate a Texas Senator, an ex-Federale launches a brutal rampage of revenge against his former boss.","Action, Crime, Thriller",6.6,105 min,6.6,60,Unknown,"Ethan Maniquis, Robert Rodriguez, Danny Trejo, Michelle Rodriguez, Robert De Niro, Jessica Alba","203,611",$26.59M
A Good Day to Die Hard,2013,"John McClane travels to Russia to help out his seemingly wayward son, Jack, only to discover that Jack is a CIA operative working undercover, causing the father and son to team up against underworld forces.","Action, Thriller",5.2,98 min,5.2,28,John Moore,"Bruce Willis, Jai Courtney, Sebastian Koch, Mary Elizabeth Winstead","214,625",$67.35M
The Great Escape,1963,Allied prisoners of war plan for several hundred of their number to escape from a German camp during World War II.,"Adventure, Drama, History",8.2,172 min,8.2,86,John Sturges,"Steve McQueen, James Garner, Richard Attenborough, Charles Bronson","257,684",$12.10M
Predestination,I) (2014,"As his last assignment, a temporal agent is tasked to travel back in time and prevent a bomb attack in New York in 1975. The hunt, however, turns out to be beyond the bounds of possibility.","Action, Drama, Sci-Fi",7.4,97 min,7.4,69,Unknown,"Michael Spierig, Peter Spierig, Ethan Hawke, Sarah Snook, Noah Taylor, Madeleine West","303,081",$0.07M
Rio,2011,"When Blu, a domesticated macaw from small-town Minnesota, meets the fiercely independent Jewel, he takes off on an adventure to Rio de Janeiro with the bird of his dreams.","Animation, Adventure, Comedy",6.9,96 min,6.9,63,Carlos Saldanha,"Jesse Eisenberg, Anne Hathaway, George Lopez, Karen Disher","246,988",$143.62M
The Number 23,2007,"Walter Sparrow becomes obsessed with a novel that he believes was written about him, as more and more similarities between himself and his literary alter ego seem to arise.","Crime, Mystery, Thriller",6.4,98 min,6.4,N/A,Joel Schumacher,"Jim Carrey, Virginia Madsen, Logan Lerman, Danny Huston","211,961",$35.19M
The Hunger Games: Mockingjay - Part 2,2015,Katniss and a team of rebels from District 13 prepare for the final battle that will decide the fate of Panem.,"Action, Adventure, Sci-Fi",6.5,137 min,6.5,65,Francis Lawrence,"Jennifer Lawrence, Josh Hutcherson, Liam Hemsworth, Woody Harrelson","370,167",$281.72M
White House Down,2013,"While on a tour of the White House with his young daughter, a Capitol policeman springs into action to save his child and protect the president from a heavily armed group of paramilitary invaders.","Action, Drama, Thriller",6.3,131 min,6.3,52,Roland Emmerich,"Channing Tatum, Jamie Foxx, Maggie Gyllenhaal, Jason Clarke","235,368",$73.10M
Hotel Transylvania,2012,"Dracula, who operates a high-end resort away from the human world, goes into overprotective mode when a boy discovers the resort and falls for the count's teenaged daughter.","Animation, Adventure, Comedy",7,91 min,7,47,Genndy Tartakovsky,"Adam Sandler, Kevin James, Andy Samberg, Selena Gomez","279,078",$148.31M
The Ugly Truth,2009,An uptight television producer takes control of a morning show segment on modern relationships hosted by a misogynistic man.,"Comedy, Romance",6.4,96 min,6.4,28,Robert Luketic,"Katherine Heigl, Gerard Butler, Bree Turner, Eric Winter","229,675",$88.92M
True Romance,1993,"In Detroit, a pop culture nerd steals cocaine from his new wife's pimp and tries to sell it in Hollywood, prompting the mobsters who own the drugs to pursue the couple.","Crime, Drama, Romance",7.9,119 min,7.9,59,Tony Scott,"Christian Slater, Patricia Arquette, Dennis Hopper, Val Kilmer","241,277",$12.28M
The Happening,2008,"A science teacher, his wife, and a young girl struggle to survive a plague that causes those infected to commit suicide.","Adventure, Drama, Sci-Fi",5,91 min,5,34,M. Night Shyamalan,"Mark Wahlberg, Zooey Deschanel, John Leguizamo, Ashlyn Sanchez","215,843",$64.51M
Austin Powers in Goldmember,2002,"Upon learning that his father has been kidnapped, Austin Powers must travel to 1975 and defeat the aptly named villain Goldmember, who is working with Dr. Evil.","Action, Adventure, Comedy",6.2,94 min,6.2,62,Jay Roach,"Mike Myers, Beyoncé, Seth Green, Michael York","222,030",$213.31M
Carlito's Way,1993,"A Puerto Rican former convict, just released from prison, pledges to stay away from drugs and violence despite the pressure around him and lead on to a better life outside of N.Y.C.","Crime, Drama, Thriller",7.9,144 min,7.9,66,Brian De Palma,"Al Pacino, Sean Penn, Penelope Ann Miller, John Leguizamo","231,361",$36.95M
A Walk to Remember,2002,"Two North Carolina teens, Landon Carter and Jamie Sullivan, are thrown together after Landon gets into trouble and is sentenced to perform community service.","Drama, Romance",7.3,101 min,7.3,35,Adam Shankman,"Mandy Moore, Shane West, Peter Coyote, Daryl Hannah","220,703",$41.28M
American Wedding,2003,"It's the wedding of Jim and Michelle and the gathering of their families and friends, including Jim's old friends from high school and Michelle's little sister.",Comedy,6.3,96 min,6.3,43,Jesse Dylan,"Jason Biggs, Alyson Hannigan, Seann William Scott, Eugene Levy","216,428",$104.57M
EuroTrip,2004,"Dumped by his girlfriend, a high school grad decides to embark on an overseas adventure in Europe with his friends.",Comedy,6.6,92 min,6.6,45,Unknown,"Jeff Schaffer, Alec Berg, David Mandel, Scott Mechlowicz, Jacob Pitts, Michelle Trachtenberg, Travis Wester","221,843",$17.72M
Rocky Balboa,2006,"Thirty years after the ring of the first bell, Rocky Balboa comes out of retirement and dons his gloves for his final fight against the reigning heavyweight champ Mason 'The Line' Dixon.","Action, Drama, Sport",7.1,102 min,7.1,63,Sylvester Stallone,"Antonio Tarver, Milo Ventimiglia, Burt Young","230,708",$70.27M
"South Park: Bigger, Longer & Uncut",1999,"When Stan Marsh and his friends go see an R-rated movie, they start cursing and their parents think that Canada is to blame.","Animation, Comedy, Fantasy",7.7,81 min,7.7,73,Trey Parker,"Matt Stone, Mary Kay Bergman, Isaac Hayes","214,263",$52.04M
The Elephant Man,1980,"A Victorian surgeon rescues a heavily disfigured man who is mistreated while scraping a living as a side-show freak. Behind his monstrous façade, there is revealed a person of kindness, intelligence and sophistication.","Biography, Drama",8.2,124 min,8.2,78,David Lynch,"Anthony Hopkins, John Hurt, Anne Bancroft, John Gielgud","257,185",N/A
Big Daddy,1999,"A lazy law school graduate adopts a kid to impress his girlfriend, but everything doesn't go as planned.","Comedy, Drama",6.4,93 min,6.4,42,Dennis Dugan,"Adam Sandler, Joey Lauren Adams, Jon Stewart, Cole Sprouse","232,853",$163.48M
Lola rennt,1998,"After a botched money delivery, Lola has 20 minutes to come up with 100,000 Deutschmarks.","Action, Crime, Thriller",7.7,81 min,7.7,79,Tom Tykwer,"Franka Potente, Moritz Bleibtreu, Herbert Knaup, Nina Petri","206,330",$7.27M
Napoleon Dynamite,2004,"A listless and alienated teenager decides to help his new friend win the class presidency in their small western high school, while he must deal with his bizarre family life back home.",Comedy,7,96 min,7,64,Jared Hess,"Jon Heder, Efren Ramirez, Jon Gries, Aaron Ruell","236,545",$44.54M
Pain & Gain,2013,A trio of bodybuilders in Florida get caught up in an extortion ring and a kidnapping scheme that goes terribly wrong.,"Action, Biography, Comedy",6.4,129 min,6.4,45,Michael Bay,"Mark Wahlberg, Dwayne Johnson, Anthony Mackie, Tony Shalhoub","228,678",$49.88M
Remember the Titans,2000,"In 1971 Virginia high school football was everything to the people of Alexandria. But when the school board was forced to integrate an all-black school with an all-white one, the very foundation of football's tradition was put to the test.","Biography, Drama, Sport",7.8,113 min,7.8,48,Boaz Yakin,"Denzel Washington, Will Patton, Wood Harris, Ryan Hurst","230,882",$115.65M
Bad Teacher,2011,"A lazy, incompetent middle school teacher who hates her job, her students, and her co-workers is forced to return to teaching to make enough money for breast implants after her wealthy fiancé dumps her.","Comedy, Romance",5.7,92 min,5.7,47,Jake Kasdan,"Cameron Diaz, Jason Segel, Justin Timberlake, Lucy Punch","211,902",$100.29M
Rush Hour 2,2001,"Carter and Lee head to Hong Kong for a vacation, but become embroiled in a counterfeit money scam.","Action, Comedy, Crime",6.7,90 min,6.7,48,Brett Ratner,"Jackie Chan, Chris Tucker, John Lone, Ziyi Zhang","237,682",$226.16M
Cube,1997,A group of strangers awaken to find themselves placed in a giant cube. Each one of them is gifted with a special skill and they must work together to escape an endless maze of deadly traps.,"Horror, Mystery, Sci-Fi",7.1,90 min,7.1,61,Vincenzo Natali,"Nicole de Boer, Maurice Dean Wint, David Hewlett, Andrew Miller","246,657",$0.50M
Ace Ventura: When Nature Calls,1995,"Ace Ventura, Pet Detective, returns from a spiritual quest to investigate the disappearance of a rare white bat, the sacred animal of a tribe in Africa.","Adventure, Comedy, Crime",6.4,90 min,6.4,43,Steve Oedekerk,"Jim Carrey, Ian McNeice, Simon Callow, Maynard Eziashi","232,395",$108.39M
Airplane!,1980,"After the crew becomes sick with food poisoning, a neurotic ex-fighter pilot must safely land a commercial airplane full of passengers.",Comedy,7.7,88 min,7.7,78,Unknown,"Jim Abrahams, David Zucker, Jerry Zucker, Robert Hays, Julie Hagerty, Leslie Nielsen, Kareem Abdul-Jabbar","259,295",$83.40M
Ben-Hur,1959,"After a Jewish prince is betrayed and sent into slavery by a Roman friend in 1st-century Jerusalem, he regains his freedom and comes back for revenge.","Adventure, Drama",8.1,212 min,8.1,90,William Wyler,"Charlton Heston, Jack Hawkins, Stephen Boyd, Haya Harareet","252,181",$74.70M
The Internship,2013,"Two salesmen whose careers have been torpedoed by the digital age find their way into a coveted internship at Google, where they must compete with a group of young, tech-savvy geniuses for a shot at employment.",Comedy,6.3,119 min,6.3,42,Shawn Levy,"Vince Vaughn, Owen Wilson, Rose Byrne, Aasif Mandvi","214,501",$44.67M
Hansel & Gretel: Witch Hunters,2013,Brother/sister duo Hansel and Gretel are professional witch-hunters who help innocent villagers. One day they stumble upon a case that could hold the key to their past.,"Action, Fantasy, Horror",6.1,88 min,6.1,23,Tommy Wirkola,"Jeremy Renner, Gemma Arterton, Peter Stormare, Famke Janssen","216,124",$55.70M
